{
  "schema_version": "neutral-license-matrix-v2",
  "legal_conclusion": "none",
  "decision_authority": null,
  "components": [
    {
      "component_id": "project-source",
      "display_name": "Neutral TTS Workbench source",
      "kind": "source",
      "bundled": true,
      "exact_version": "RESOLVED_AT_BUILD_FROM_EXACT_COMMIT_ARGUMENT",
      "source_url": null,
      "artifact_url": null,
      "sha256": null,
      "license_spdx": "MIT",
      "license_status": "APPROVED",
      "redistribution_status": "PERMITTED_UNDER_MIT",
      "notice_required": true,
      "notice_status": "PRESENT",
      "approval_status": "APPROVED",
      "approval_authority": "rtonf"
    },
    {
      "component_id": "irodori-tts-compatibility",
      "display_name": "Irodori-TTS compatible engine boundary",
      "kind": "vendor-source-and-runtime",
      "bundled": false,
      "exact_version": "0.1.0+ntts.8ca3acb58ab4",
      "source_url": "https://codeload.github.com/Aratako/Irodori-TTS/zip/8ca3acb58ab4e19ad6d594aaed6bafe3e88f7f71",
      "artifact_url": "https://codeload.github.com/Aratako/Irodori-TTS/zip/8ca3acb58ab4e19ad6d594aaed6bafe3e88f7f71",
      "sha256": "f5fccadc766bfee753cbb18f651cc36ec5ee30246c5bd9c2a8844c495c12b54a",
      "license_spdx": "MIT",
      "license_status": "OFFICIAL_FIXED_SOURCE_REVIEWED",
      "redistribution_status": "NOT_APPROVED",
      "notice_required": true,
      "notice_status": "SEE_INFERENCE_COMPONENTS_AND_ORIGINAL_LICENSE",
      "approval_status": "NOT_APPROVED",
      "approval_authority": null,
      "required_use_of_name": "compatibility_and_attribution_only"
    },
    {
      "component_id": "silentcipher-checkpoint",
      "display_name": "SilentCipher checkpoint",
      "kind": "model-checkpoint",
      "bundled": false,
      "exact_version": null,
      "source_url": null,
      "artifact_url": null,
      "sha256": null,
      "license_spdx": "NOASSERTION",
      "license_status": "NOT_APPROVED",
      "redistribution_status": "NOT_APPROVED",
      "notice_required": null,
      "notice_status": "UNKNOWN_PENDING_EXACT_LICENSE",
      "approval_status": "NOT_APPROVED",
      "approval_authority": null
    },
    {
      "component_id": "modernbert-ja-tokenizer",
      "display_name": "sbintuitions/modernbert-ja-310m tokenizer assets",
      "kind": "tokenizer",
      "bundled": false,
      "exact_version": null,
      "source_url": null,
      "artifact_url": null,
      "sha256": null,
      "license_spdx": "NOASSERTION",
      "license_status": "NOT_APPROVED",
      "redistribution_status": "NOT_APPROVED",
      "notice_required": null,
      "notice_status": "UNKNOWN_PENDING_EXACT_LICENSE",
      "approval_status": "NOT_APPROVED",
      "approval_authority": null
    },
    {
      "component_id": "semantic-dacvae-codec",
      "display_name": "semantic-dacvae-japanese-32dim codec weights",
      "kind": "codec-weights",
      "bundled": false,
      "exact_version": "47376ee24834d7a05a48ebabfe3cde29b3c5e214",
      "source_url": "https://huggingface.co/Aratako/Semantic-DACVAE-Japanese-32dim",
      "artifact_url": "https://huggingface.co/Aratako/Semantic-DACVAE-Japanese-32dim/resolve/47376ee24834d7a05a48ebabfe3cde29b3c5e214/weights.pth",
      "sha256": "db120339c5ee7eca1912cdf29bc612b947a0808e69c3cebfb4936b45a762c1d5",
      "license_spdx": "MIT",
      "license_status": "OFFICIAL_FIXED_SOURCE_REVIEWED",
      "redistribution_status": "NOT_APPROVED",
      "notice_required": true,
      "notice_status": "SEE_INFERENCE_COMPONENTS_AND_ORIGINAL_LICENSE",
      "approval_status": "NOT_APPROVED",
      "approval_authority": null
    },
    {
      "component_id": "sounddevice",
      "display_name": "sounddevice playback package",
      "kind": "python-playback-package",
      "bundled": false,
      "exact_version": null,
      "source_url": null,
      "artifact_url": null,
      "sha256": null,
      "license_spdx": "MIT",
      "license_status": "NOT_APPROVED",
      "redistribution_status": "NOT_APPROVED_FOR_PUBLIC_RELEASE",
      "notice_required": true,
      "notice_status": "REQUIRED_NOTICE_NOT_COLLECTED",
      "approval_status": "NOT_APPROVED",
      "approval_authority": null
    },
    {
      "component_id": "portaudio",
      "display_name": "PortAudio native playback library",
      "kind": "native-playback-library",
      "bundled": false,
      "exact_version": null,
      "source_url": null,
      "artifact_url": null,
      "sha256": null,
      "license_spdx": "MIT",
      "license_status": "NOT_APPROVED",
      "redistribution_status": "NOT_APPROVED_FOR_PUBLIC_RELEASE",
      "notice_required": true,
      "notice_status": "REQUIRED_NOTICE_NOT_COLLECTED",
      "approval_status": "NOT_APPROVED",
      "approval_authority": null
    },
    {
      "component_id": "python-cuda-native-runtime",
      "display_name": "Python, CUDA, and native runtime closure",
      "kind": "runtime-closure",
      "bundled": false,
      "exact_version": null,
      "source_url": null,
      "artifact_url": null,
      "sha256": null,
      "license_spdx": "NOASSERTION",
      "license_status": "NOT_REVIEWED",
      "redistribution_status": "NOT_REVIEWED",
      "notice_required": null,
      "notice_status": "UNKNOWN_PENDING_EXACT_CLOSURE",
      "approval_status": "NOT_APPROVED",
      "approval_authority": null
    },
    {
      "component_id": "alternative-voice-assets",
      "display_name": "Alternative voice profiles and reference audio",
      "kind": "voice-assets",
      "bundled": false,
      "exact_version": null,
      "source_url": null,
      "artifact_url": null,
      "sha256": null,
      "license_spdx": "NOASSERTION",
      "license_status": "RIGHTS_AND_CONSENT_REQUIRED",
      "redistribution_status": "RIGHTS_AND_CONSENT_REQUIRED",
      "notice_required": null,
      "notice_status": "UNKNOWN_PENDING_RIGHTS_REVIEW",
      "approval_status": "NOT_APPROVED",
      "approval_authority": null
    }
  ]
}
